shot_idx,start_sec,end_sec,duration_sec,vision_caption,vision_camera_from_vlm,vision_emotion,vision_colors,vision_entities,vision_location,vision_lighting,vision_composition,camera_motion,camera_pan_score,camera_tilt_score,camera_zoom_score,audio_top_mood,audio_mood_happy and bright,audio_mood_sad and melancholic,audio_mood_aggressive and intense,audio_mood_romantic and tender,audio_mood_triumphant and epic,audio_mood_calm and peaceful,audio_mood_tense and anxious,audio_mood_dreamy and ethereal,audio_mood_dark and ominous,audio_mood_playful and whimsical,audio_mood_lonely and introspective,audio_mood_powerful and confident,music_avg_rms,music_n_beats,cut_on_beat,n_lyric_segments,lyric_text
58,173.423,174.925,1.502,"A woman with long, flowing blonde hair stands in a dark",static,contemplative,"black, white, blue","woman, waterfall, rocks, mist, white garment, long hair","This scene is outdoor.

Setting",Bright ethereal backlighting,backlit medium shot silhouette,pan-right,1.0,-0.447,-0.637,powerful and confident,0.2819,0.0007,0.0018,0.001,0.0004,0.0002,0.0091,0.0053,0.0028,0.0015,0.0002,0.4735,0.37824,4,False,0,
59,174.925,177.594,2.669,"Two women, one with long blonde hair and the",static,"sensual, intense","tan, brown, black","blonde woman, dark-haired woman, sand, dry branches, lattice wall, bikini tops, pants, jewelry","This scene is indoor.

Setting description",warm golden interior glow,Medium shot of two women.,tilt-down,0.108,0.131,0.012,powerful and confident,0.3203,0.0007,0.0039,0.0011,0.0003,0.0002,0.0083,0.0046,0.0042,0.0021,0.0002,0.3423,0.36323,9,False,0,
60,177.594,179.596,2.002,"A woman with long, wavy blonde hair stands in a",zoom-in,sensual,"black, white, brown","woman, long blonde hair, white fabric, rock wall, mist, bright light","This scene is outdoor.

Setting description: Dark",Bright ethereal backlighting,Medium shot from behind,zoom-in,-0.408,0.268,0.117,happy and bright,0.3587,0.0006,0.0059,0.0012,0.0001,0.0002,0.0076,0.0038,0.0056,0.0026,0.0002,0.211,0.35964,6,False,0,
61,179.596,181.973,2.377,"A person with long, flowing blonde hair and",handheld,joyful,"white, black, brown","person, long blonde hair, white costume, feathers, bright light, dark background","This scene is outdoor.

Setting description: Misty",bright ethereal backlighting,medium shot back view,pan-right,0.451,-0.585,-0.776,happy and bright,0.2824,0.0014,0.0038,0.0014,0.0001,0.0007,0.0164,0.0029,0.01,0.0031,0.0004,0.2307,0.33456,7,False,0,
62,181.973,183.392,1.419,"In a dimly lit, rocky setting, a person with long",pan,fearful,"black, white, tan","woman, blonde hair, arm, hand, rock wall,","Based on the image, this scene",Dramatic cool backlighting,"Accurate.
    *   ""Medium close-up profile",pan-left,0.0,0.746,0.844,powerful and confident,0.2061,0.0022,0.0017,0.0016,0.0,0.0013,0.0252,0.0019,0.0144,0.0035,0.0006,0.2504,0.34903,7,True,0,
63,183.392,185.519,2.127,"A woman with long, wavy blonde hair and dark eye makeup",zoom-in,neutral,"black, white, blonde","woman, blonde hair, face, eyes, lips, white top, smoke, background","This scene is indoor.

**Setting",bright backlit glow,close-up portrait shot,tilt-down,0.657,0.899,-0.642,powerful and confident,0.2371,0.0034,0.0015,0.0034,0.0001,0.0009,0.0309,0.0027,0.0103,0.0037,0.0004,0.2804,0.333,6,True,0,
64,185.519,189.981,4.462,"A woman with long, backlit blonde hair poses in a revealing",zoom-in,confident,"white, black, blue","woman, white dress, waterfall, rocks, earrings, arm band","This scene is outdoor.

Setting description: Waterfall against",Bright backlit ethereal glow,Medium shot centered woman,tilt-down,0.028,0.237,0.24,powerful and confident,0.2681,0.0045,0.0012,0.0053,0.0001,0.0005,0.0366,0.0034,0.0062,0.0039,0.0003,0.3105,0.34537,10,False,0,
65,189.981,191.817,1.836,"A person with long, flowing blonde hair stands in a dark",pan,joyful,"white, black, brown","person, long hair, white fabric, rocks, cave, light, mist","This scene is indoor.

Setting description: Dark",bright cool backlighting (3 words) - Good.,medium shot back view,zoom-in,-0.165,0.039,-0.738,powerful and confident,0.2046,0.0063,0.0019,0.0067,0.0002,0.0008,0.0438,0.0045,0.0238,0.0023,0.0006,0.3422,0.36863,6,False,0,
66,191.817,198.949,7.132,"A blonde woman with long, wavy hair stands in a dark",zoom-in,confident,"white, black, blonde","woman, blonde hair, white dress, rocks, mist, light source","This scene is outdoor.

Setting",Bright ethereal backlighting mist,"medium shot, centered subject",tilt-down,-0.309,0.238,0.126,powerful and confident,0.1171,0.0047,0.0015,0.0048,0.0001,0.0006,0.0312,0.0037,0.0269,0.0008,0.0005,0.2705,0.2965,17,False,0,
67,198.949,200.492,1.543,"A woman with long, wavy blonde hair and a white",zoom-in,seductive,"black, blonde, white","woman, blonde hair, white dress, smoke, dark background","This scene is indoor.

Setting description","Bright, hazy backlighting.",medium close-up portrait,tilt-up,-0.495,0.245,0.443,powerful and confident,0.0624,0.0008,0.0006,0.0018,0.0,0.0001,0.0076,0.001,0.0075,0.0014,0.0001,0.0964,0.25089,6,True,0,
68,200.492,204.037,3.545,"A blonde woman with long, wavy hair and",zoom-in,playful,"black, blonde, white","woman, blonde hair, white dress, smoke, dark background","Based on the dark, misty background and what appear to",bright backlit studio glow,medium close-up face,tilt-down,0.278,0.879,-0.192,happy and bright,0.0317,0.0004,0.0009,0.002,0.0,0.0001,0.0037,0.0002,0.0026,0.0019,0.0,0.0257,0.23532,10,False,0,
69,204.037,208.208,4.171,"Two women, one with blonde hair and the other with",handheld,sultry,"brown, gold, black","two women, gold bikinis, earrings,","Based on the image, this scene is **indoor**.",warm golden glow,Medium shot two women,pan-right,0.082,0.371,0.376,powerful and confident,0.0342,0.0019,0.0006,0.0026,0.0001,0.0001,0.0179,0.0015,0.0148,0.0013,0.0001,0.0377,0.27193,11,True,0,
70,208.208,213.13,4.922,"Two women, one with long dark",handheld,Confident/Seductive,"beige, black, brown","two women, concrete wall, cracked pillar, stone background","Based on the image, this scene is **indoor**.",warm golden sunlight,medium close-up shot,tilt-down,0.186,-0.09,-0.036,powerful and confident,0.0187,0.0025,0.0012,0.0033,0.0001,0.0002,0.022,0.0051,0.0411,0.0005,0.0002,0.0838,0.19117,6,True,0,
71,213.13,215.34,2.21,"A woman with long, dark hair",handheld,joyful,"white, black, grey","woman, long black hair, gold top, unbuttoned jeans, belly button piercing, red nail polish, wall","The scene is indoor.

Setting description: Plain",bright warm light,medium shot waist up,static,0.0,0.0,0.0,powerful and confident,0.0008,0.0016,0.002,0.0035,0.0001,0.0003,0.012,0.0074,0.0553,0.0002,0.0003,0.1178,1e-05,0,False,0,
