shot_idx,start_sec,end_sec,duration_sec,vision_caption,vision_camera_from_vlm,vision_emotion,vision_colors,vision_entities,vision_location,vision_lighting,vision_composition,camera_motion,camera_pan_score,camera_tilt_score,camera_zoom_score,audio_top_mood,audio_mood_happy and bright,audio_mood_sad and melancholic,audio_mood_aggressive and intense,audio_mood_romantic and tender,audio_mood_triumphant and epic,audio_mood_calm and peaceful,audio_mood_tense and anxious,audio_mood_dreamy and ethereal,audio_mood_dark and ominous,audio_mood_playful and whimsical,audio_mood_lonely and introspective,audio_mood_powerful and confident,music_avg_rms,music_n_beats,cut_on_beat,n_lyric_segments,lyric_text
58,173.423,174.925,1.502,"A woman with long, dark wavy hair gazes",handheld,confident,"black, brown, white","woman, hair, shoulder, hand, background wall, light openings","Based on the image, this scene is **indoor",warm golden backlight,close-up face and shoulder,tilt-up,-0.575,-1.0,1.0,powerful and confident,0.2819,0.0007,0.0018,0.001,0.0004,0.0002,0.0091,0.0053,0.0028,0.0015,0.0002,0.4735,0.37824,4,False,0,
59,174.925,177.594,2.669,"A woman with dark, wind-swept hair looks back",static,seductive,"black, tan, white","woman, hair, face, tongue, shoulder, wall, light","This scene is indoor.

Setting description: Brightly",Bright golden backlighting,close-up face and shoulder,zoom-in,0.517,-0.25,-0.109,powerful and confident,0.3203,0.0007,0.0039,0.0011,0.0003,0.0002,0.0083,0.0046,0.0042,0.0021,0.0002,0.3423,0.36323,9,False,0,
60,177.594,179.596,2.002,A woman with dark hair and long pink nails looks intensely over,handheld,angry,"black, brown, beige","woman, hair, face, shoulder, hand, pink nails, background wall","Based on the lighting and background, this scene is",harsh warm direct sunlight,"This is accurate.
    *   """,zoom-in,0.032,0.318,-0.474,happy and bright,0.3587,0.0006,0.0059,0.0012,0.0001,0.0002,0.0076,0.0038,0.0056,0.0026,0.0002,0.211,0.35964,6,False,0,
61,179.596,181.973,2.377,"A woman with long, dark, wavy hair and",handheld,confident,"black, brown, beige","woman, hair, earring, clothing, wall, light patterns","This scene is indoor.

Setting description:",warm golden studio light,close-up head and shoulders shot,pan-right,0.309,-0.258,-1.0,happy and bright,0.2824,0.0014,0.0038,0.0014,0.0001,0.0007,0.0164,0.0029,0.01,0.0031,0.0004,0.2307,0.33456,7,False,0,
62,181.973,183.392,1.419,"A woman with long dark hair, wearing a short dark",dolly,contemplative,"black, white, brown","woman, dress, boots, cave, rocks, waterfall, light source","This scene is indoor.

Setting","Moody, high-contrast cave lighting","Accurate.
    *   ""Wide shot of woman",tilt-up,-0.442,0.0,-0.314,powerful and confident,0.2061,0.0022,0.0017,0.0016,0.0,0.0013,0.0252,0.0019,0.0144,0.0035,0.0006,0.2504,0.34903,7,True,0,
63,183.392,185.519,2.127,"A woman with long, dark hair stands in silhouette within a",dolly,neutral,"brown, black, orange","woman, cave walls, fire, waterfall","This scene is indoor.

Setting description:",warm golden backlighting,medium shot backlit silhouette,tilt-down,0.428,0.637,-0.06,powerful and confident,0.2371,0.0034,0.0015,0.0034,0.0001,0.0009,0.0309,0.0027,0.0103,0.0037,0.0004,0.2804,0.333,6,True,0,
64,185.519,189.981,4.462,A silhouetted figure with long hair is captured in,static,joyful,"brown, yellow, black","person, wall, light, openings, holes, floor","Based on the image, this scene is",backlit golden silhouette,Full body silhouette shot,static,0.326,-0.254,0.052,powerful and confident,0.2681,0.0045,0.0012,0.0053,0.0001,0.0005,0.0366,0.0034,0.0062,0.0039,0.0003,0.3105,0.34537,10,False,0,
65,189.981,191.817,1.836,A blonde woman in a tan bikini top and,handheld,joyful,"beige, white, yellow","woman, blonde hair, bikini top, bikini bottom, wall with openings, branches, background wall","This scene is indoor.

Setting description: Sandy stone room",Bright warm golden light,Medium shot of woman,zoom-in,-0.385,0.011,-0.839,powerful and confident,0.2046,0.0063,0.0019,0.0067,0.0002,0.0008,0.0438,0.0045,0.0238,0.0023,0.0006,0.3422,0.36863,6,False,0,
66,191.817,198.949,7.132,"A woman with long, backlit hair",tilt,joyful,"black, white, blue","woman, waterfall, rocks, water spray, white dress","This scene is outdoor.

Setting",bright cool backlighting,Medium silhouette waterfall shot,zoom-in,-0.022,-0.003,-0.523,powerful and confident,0.1171,0.0047,0.0015,0.0048,0.0001,0.0006,0.0312,0.0037,0.0269,0.0008,0.0005,0.2705,0.2965,17,False,0,
67,198.949,200.492,1.543,Two people are dancing closely together in a dimly lit,handheld,passionate,"tan, black, beige","people, dark pants, patterned pants, hands, yellow fingernails, wall","This scene is indoor.

Setting",Soft warm golden glow,close-up midsection shot,zoom-out,-0.427,-0.538,0.034,powerful and confident,0.0624,0.0008,0.0006,0.0018,0.0,0.0001,0.0076,0.001,0.0075,0.0014,0.0001,0.0964,0.25089,6,True,0,
68,200.492,204.037,3.545,"A woman in a flowing, light-colored bodysuit stands",pan,contemplative,"beige, white, brown","woman, dress, wall, openings, log, light, floor","Based on the image, this scene is **",bright hazy golden light,full body wide shot,zoom-out,-0.813,0.106,0.236,happy and bright,0.0317,0.0004,0.0009,0.002,0.0,0.0001,0.0037,0.0002,0.0026,0.0019,0.0,0.0257,0.23532,10,False,0,
69,204.037,208.208,4.171,"A person with long, dark, wavy hair and an open",handheld,passionate,"black, gold, brown","woman, long dark hair, open mouth, gold choker, sparkles, background texture","This scene is indoor.

Setting description: Dark",warm golden glow,Close-up face and neck,pan-left,-0.412,0.04,-0.485,powerful and confident,0.0342,0.0019,0.0006,0.0026,0.0001,0.0001,0.0179,0.0015,0.0148,0.0013,0.0001,0.0377,0.27193,11,True,0,
70,208.208,213.13,4.922,"Two women dance closely together in a rustic, sunlit",pan,passionate energy,"beige, black, yellow","Woman with dark hair, woman with blonde hair, yellow","This scene is indoor.

Setting description: Weathered,",warm golden sunlight,medium shot of two women,zoom-in,0.226,-0.327,-0.546,powerful and confident,0.0187,0.0025,0.0012,0.0033,0.0001,0.0002,0.022,0.0051,0.0411,0.0005,0.0002,0.0838,0.19117,6,True,0,
71,213.13,215.34,2.21,"The image features the stylized text ""A*POP"" in",static,No people.,"black, pink, white","""A*POP"" text, letter A, star symbol, letter P, letter O, black background","This scene is indoor.

Setting description: Pink",vibrant pink highlights contrast,Centered graphic on black.,static,0.0,0.0,0.0,powerful and confident,0.0008,0.0016,0.002,0.0035,0.0001,0.0003,0.012,0.0074,0.0553,0.0002,0.0003,0.1178,1e-05,0,False,0,
